<?xml version="1.0"?>
<accounts
xmlns:xsi="http://www.w3.org/2001/XMLSchema-instance"
xsi:noNamespaceSchemaLocation="../../xml-types/accounts.xsd">
  <account>
    <name>Luca</name>
    <surname>Guerra</surname>
    <username>luca</username>
    <password>123456</password>
    <role>doctor</role>
    <patients>
        <patient>
            <name>marco</name>
            <lastVisit>1</lastVisit>
        </patient>
        <patient>
            <name>fabio</name>
            <lastVisit>2</lastVisit>
        </patient>
        <patient>
            <name>riccardo</name>
            <lastVisit>3</lastVisit>
        </patient>
    </patients>
  </account>
  <account>
    <name>Marco</name>
    <surname>Franceschini</surname>
    <username>marco</username>
    <password>123456</password>
    <role>patient</role>
    <doctor>
        <name>luca</name>
        <lastVisit>3</lastVisit>
    </doctor>
  </account>
  <account>
    <name>Fabio</name>
    <surname>Consalici</surname>
    <username>fabio</username>
    <password>123456</password>
    <role>patient</role>
    <doctor>
        <name>luca</name>
        <lastVisit>3</lastVisit>
    </doctor>
  </account>
  <account>
    <name>Riccardo</name>
    <surname>Drudi</surname>
    <username>riccardo</username>
    <password>123456</password>
    <role>patient</role>
    <doctor>
        <name>luca</name>
        <lastVisit>3</lastVisit>
    </doctor>
  </account>
</accounts>
